{"type":"config","name":"UT Optimization: Speed + Coverage 90%+","metricName":"test_time_ms","metricUnit":"ms","bestDirection":"lower"}
{"run":1,"commit":"7bd8cad","metric":1171,"metrics":{"coverage_pct":93.31,"test_count":920,"expect_calls":2191},"status":"keep","description":"Baseline: 920 tests, 1171ms, 93.31% coverage","timestamp":1776422627502,"segment":0,"confidence":null,"iterationTokens":152,"asi":{"hypothesis":"Establish baseline metrics for UT optimization","baseline":true}}
{"run":2,"commit":"c55109f","metric":993,"metrics":{"coverage_pct":93.31,"expect_calls":2155,"test_count":865},"status":"keep","description":"Consolidate tests: 920→865 tests, 1171→993ms (-15%), coverage 93.31%","timestamp":1776424142890,"segment":0,"confidence":null,"iterationTokens":343,"asi":{"hypothesis":"Consolidate redundant test cases without losing coverage","tests_removed":55,"time_saved_ms":178}}
{"run":3,"commit":"aafd94b","metric":1005,"metrics":{"coverage_pct":93.31,"expect_calls":2155,"test_count":865},"status":"keep","description":"Consolidate tests: 920→865 tests, 1171→1005ms (-14%), coverage 93.31%","timestamp":1776424484805,"segment":0,"confidence":14.833333333333334,"iterationTokens":50773,"asi":{"hypothesis":"Consolidate redundant test cases without losing coverage","tests_removed":55,"time_saved_ms":166,"files_changed":["category-config.test.ts","proxy-logic.test.ts","totp-module.test.ts"]}}
{"run":4,"commit":"da67819","metric":984,"metrics":{"coverage_pct":93.31,"expect_calls":2155,"test_count":864},"status":"keep","description":"Merge seed-remote guard tests: 865→864 tests, 1005→984ms","timestamp":1776424983221,"segment":0,"confidence":17.80952380952381,"iterationTokens":2315,"asi":{"files_changed":["db/index.test.ts"],"hypothesis":"Merge two subprocess spawn tests into one to reduce process startup overhead","tests_removed":1}}
{"run":5,"commit":"da67819","metric":1012,"metrics":{"coverage_pct":93.31,"expect_calls":2080,"test_count":847},"status":"discard","description":"Consolidate sidebar-nav & chart-config tests: 864→847 tests, 984→1012ms","timestamp":1776425424981,"segment":0,"confidence":15.583333333333334,"iterationTokens":365,"asi":{"files_changed":["sidebar-nav.test.ts","chart-config.test.ts"],"hypothesis":"Consolidate config/constant tests without losing critical assertions","tests_removed":17}}
{"run":6,"commit":"da67819","metric":982,"metrics":{"coverage_pct":93.31,"expect_calls":2123,"test_count":857},"status":"keep","description":"Consolidate dashboard-vm tests: 864→857 tests, 984→982ms","timestamp":1776425614635,"segment":0,"confidence":13.5,"iterationTokens":376,"asi":{"files_changed":["dashboard-vm.test.ts"],"hypothesis":"Consolidate createStatCards tests into fewer comprehensive tests","tests_removed":7}}
{"type":"config","name":"L2 Coverage: 补充 2FA 和 Attachments E2E 测试","metricName":"l2_coverage_pct","metricUnit":"%","bestDirection":"higher"}
{"run":7,"commit":"6025cc9","metric":93.2,"metrics":{"covered_endpoints":69,"total_endpoints":74,"new_endpoints":5},"status":"keep","description":"添加 2FA E2E 测试覆盖 (5 个端点: status, setup, verify-setup, disable, verify-2fa)","timestamp":1776462610799,"segment":1,"confidence":null,"iterationTokens":483,"asi":{"hypothesis":"添加 2FA API 的 E2E 测试将提升 L2 覆盖率","approach":"创建 getSessionForApi() helper 支持 E2E 模式下的 mock session，添加 /api/settings/2fa/reset 端点用于测试清理，编写完整的 2FA lifecycle E2E 测试","findings":"2FA E2E 测试需要：1) mock session 支持 E2E_SKIP_AUTH 模式，2) 测试专用 reset 端点清理 totp.* 设置，3) otpauth 库生成有效 TOTP token","coverage_before":"86.4%","coverage_after":"93.2%"}}
{"type":"config","name":"Pre-commit / Pre-push hook performance optimization","metricName":"total_ms","metricUnit":"ms","bestDirection":"lower"}
{"run":8,"commit":"8fc939d","metric":6087,"metrics":{"test_ms":1210,"lint_ms":3983,"typecheck_ms":894},"status":"keep","description":"Baseline: pre-commit total 6087ms (test 1210, lint 3983, typecheck 894). Best-of-3 trials.","timestamp":1776551292474,"segment":2,"confidence":null,"iterationTokens":224,"asi":{"hypothesis":"Establish baseline for pre-commit hook (test:coverage + lint + typecheck). Pre-push (osv + gitleaks + e2e) needs network and is excluded from local benchmarking.","baseline":true,"bottleneck":"lint dominates at ~4s — eslint cold start"}}
{"run":9,"commit":"87074c7","metric":4140,"metrics":{"lint_ms":4139,"test_ms":1296,"typecheck_ms":976},"status":"keep","description":"Parallelize pre-commit steps: 6087→4140ms (-32%), bottleneck is lint at ~4s","timestamp":1776551380583,"segment":2,"confidence":null,"iterationTokens":4131,"asi":{"approach":"scripts/pre-commit.ts spawns the three independent steps concurrently and replays output on failure","hypothesis":"test:coverage, lint-staged, and typecheck are independent — run them in parallel"}}
{"run":10,"commit":"de8ecd8","metric":1393,"metrics":{"lint_ms":646,"test_ms":1393,"typecheck_ms":990},"status":"keep","description":"Enable eslint --cache: lint 4139→646ms warm, total 4140→1393ms (-66%)","timestamp":1776551429338,"segment":2,"confidence":2.410888546481767,"iterationTokens":2505,"asi":{"approach":"--cache --cache-location node_modules/.cache/eslint/ on both `lint` script and lint-staged invocation","hypothesis":"Add eslint --cache so warm pre-commit runs only re-lint changed files","lint_warm_ms":646,"new_bottleneck":"test (1393ms) and typecheck (990ms)"}}
{"run":11,"commit":"de8ecd8","metric":1385,"metrics":{"lint_ms":645,"test_ms":1385,"typecheck_ms":996},"status":"discard","description":"Parallelize seed-remote subprocess guard tests (within-noise)","timestamp":1776551519958,"segment":2,"confidence":3.4076225045372053,"iterationTokens":5234,"asi":{"hypothesis":"Run two seed-remote subprocess guard tests concurrently to halve subprocess wait time","next_action_hint":"Test subprocess overhead is small fraction of total — look at coverage instrumentation overhead or parallelizing test files instead","rollback_reason":"1393→1385 within noise; test parallelism savings don't show at hook level because tests are not the long pole when run with coverage in this trial"}}
{"type":"config","name":"Pre-push local checks (osv + gitleaks) parallelization","metricName":"pre_push_local_ms","metricUnit":"ms","bestDirection":"lower"}
{"type":"config","name":"Pre-push local checks (osv + gitleaks) parallelization","metricName":"total_ms","metricUnit":"ms","bestDirection":"lower"}
{"run":12,"commit":"5ec4367","metric":4216,"metrics":{"gitleaks_ms":89,"osv_scanner_ms":4114},"status":"keep","description":"Baseline pre-push (sequential): osv-scanner 4114ms + gitleaks 89ms = 4216ms","timestamp":1776551781831,"segment":4,"confidence":null,"iterationTokens":5234,"asi":{"hypothesis":"Sequential baseline for pre-push non-network steps. osv-scanner is the dominant cost (~4s, network).","note":"e2e excluded from bench (network + remote D1 + dev server, would add 30s+)"}}
{"run":13,"commit":"5ec4367","metric":4414,"metrics":{"gitleaks_ms":20,"osv_scanner_ms":4414},"status":"discard","description":"Parallel osv + gitleaks: 4216→4414ms (within osv network noise; no real benefit since gitleaks tiny)","timestamp":1776551816522,"segment":4,"confidence":null,"iterationTokens":959,"asi":{"hypothesis":"Run osv + gitleaks in parallel — expected near-zero benefit because gitleaks is 20-90ms but osv is 4s","next_action_hint":"Real value of parallelization is overlap with e2e. Build a benchmark that includes e2e to measure that.","rollback_reason":"Within-noise; parallelization between two steps where one is 50x larger has no measurable effect"}}
{"type":"config","name":"Pre-commit / Pre-push hook performance optimization","metricName":"total_ms","metricUnit":"ms","bestDirection":"lower"}
{"run":14,"commit":"8b5eb5e","metric":1267,"metrics":{"lint_ms":592,"test_ms":1267,"typecheck_ms":925},"status":"keep","description":"Re-baseline pre-commit: 1267ms (test 1267, lint 592, typecheck 925), wall=test","timestamp":1776551877757,"segment":5,"confidence":null,"iterationTokens":959,"asi":{"hypothesis":"Re-baseline after pre-push parallelization commits. Pre-commit wall is dominated by test_ms (1267ms) which is bun test --coverage."}}
{"run":15,"commit":"03b1397","metric":1080,"metrics":{"lint_ms":580,"test_ms":1080,"typecheck_ms":897},"status":"keep","description":"describe.concurrent for TotpService scrypt-bound blocks: 1267→1080ms (-15%)","timestamp":1776552092888,"segment":5,"confidence":null,"iterationTokens":13570,"asi":{"approach":"Convert isolated TotpService describe blocks + recovery code block to describe.concurrent. Each block creates its own MemoryStore so concurrency is safe.","files_changed":["src/__tests__/totp-module.test.ts"],"hypothesis":"TotpService scrypt/PBKDF tests are CPU-bound and independent (each creates own store) — use describe.concurrent to overlap hash work","totp_file_ms":"422→190ms in isolation"}}
{"run":16,"commit":"7d2598d","metric":997,"metrics":{"lint_ms":563,"test_ms":997,"typecheck_ms":890},"status":"keep","description":"Parallelize seed-remote subprocess guards: 1080→997ms (-7.7%, sub-1s!)","timestamp":1776552328025,"segment":5,"confidence":3.253012048192771,"iterationTokens":380,"asi":{"approach":"Spawn both seed-remote subprocess guard cases concurrently in the same test","files_changed":["src/__tests__/db/index.test.ts"],"hypothesis":"Parallelize the two seed-remote subprocess guard spawns — they each cost ~75ms serially, can run together"}}
{"run":17,"commit":"3e5ec72","metric":963,"metrics":{"lint_ms":596,"test_ms":963,"typecheck_ms":914},"status":"keep","description":"Full describe.concurrent in totp-module: 997→963ms (-3.4%)","timestamp":1776552407234,"segment":5,"confidence":5.196581196581197,"iterationTokens":380,"asi":{"approach":"Convert all describe blocks in totp-module to describe.concurrent (each test creates its own MemoryStore so isolation is preserved)","files_changed":["src/__tests__/totp-module.test.ts"],"hypothesis":"Make remaining describe blocks in totp-module.test.ts concurrent for further overlap of crypto-bound tests"}}
{"run":18,"commit":"3e5ec72","metric":1029,"metrics":{"lint_ms":583,"test_ms":1029,"typecheck_ms":911},"status":"discard","description":"describe.concurrent for backy-service pure-fn blocks (within-noise)","timestamp":1776552468080,"segment":5,"confidence":5.96078431372549,"iterationTokens":4643,"asi":{"hypothesis":"Mark backy-service maskApiKey + getEnvironment describe blocks as concurrent (pure functions)","rollback_reason":"Within-noise (1029 vs 963); pure-fn tests are already so fast that concurrent setup overhead matches savings"}}
{"run":19,"commit":"3e5ec72","metric":981,"metrics":{"lint_ms":587,"test_ms":981,"typecheck_ms":910},"status":"discard","description":"Direct-binary pre-commit (skip bun run/bunx wrappers): within-noise","timestamp":1776552526382,"segment":5,"confidence":7.414634146341464,"iterationTokens":3195,"asi":{"hypothesis":"Skip `bun run` wrappers in pre-commit and bench scripts — use direct binary calls","rollback_reason":"Within-noise (981 vs 963); bun run overhead is small in macOS"}}
{"run":20,"commit":"3e5ec72","metric":1423,"metrics":{"lint_ms":680,"test_ms":1423,"typecheck_ms":980},"status":"discard","description":"Verification re-run (no code change): noisy 1289-1423ms vs prior best 963","timestamp":1776552653016,"segment":5,"confidence":5.96078431372549,"iterationTokens":378,"asi":{"hypothesis":"Verification rerun — measure stability","next_action_hint":"Numbers are noisy on macOS due to system load + CPU thermal. Best-of-N stays around 950-1050ms.","rollback_reason":"No code change — verification only; metric within noise band"}}
{"run":21,"commit":"3e5ec72","metric":1883,"metrics":{"lint_ms":664,"test_ms":1883,"typecheck_ms":969},"status":"discard","description":"Parallelize 3 scrypt verifications in recovery code roundtrip test (noisy bench)","timestamp":1776552803091,"segment":5,"confidence":3.684848484848485,"iterationTokens":382,"asi":{"hypothesis":"Run the 3 verifyRecoveryCode scrypt calls in 'hash and verify round-trip' concurrently — each is ~17ms scrypt","rollback_reason":"Noisy verification (1029-1883ms), can't confirm improvement; system load high. Change is correct but unmeasurable.","savings_estimate":"~30ms in isolation"}}
{"run":22,"commit":"3e5ec72","metric":1100,"metrics":{"lint_ms":658,"test_ms":1100,"typecheck_ms":960},"status":"discard","description":"Re-baseline (no change): 1100ms — confirms steady state ≈1.0s","timestamp":1776552863291,"segment":5,"confidence":3.0707070707070705,"iterationTokens":1076,"asi":{"hypothesis":"Re-baseline after noise spike. Steady state appears to be ~1000-1100ms wall (test).","next_action_hint":"System noise dominates further optimization attempts. Real-world warm pre-commit is sub-second."}}
{"run":23,"commit":"3e5ec72","metric":1185,"metrics":{"lint_ms":581,"test_ms":1185,"typecheck_ms":926},"status":"discard","description":"tsconfig.assumeChangesOnlyAffectDirectDependencies (within-noise)","timestamp":1776552977145,"segment":5,"confidence":2.980392156862745,"iterationTokens":388,"asi":{"hypothesis":"Add assumeChangesOnlyAffectDirectDependencies to tsconfig for slightly faster incremental typecheck","next_action_hint":"tsconfig change is conceptually sound (edge-only re-typing) but yields no measurable improvement because typecheck is not the wall (test is)","rollback_reason":"Within-noise (1185 vs 963 prior best); typecheck is not the wall pole, test is"}}
{"run":24,"commit":"3e5ec72","metric":987,"metrics":{"lint_ms":600,"test_ms":987,"typecheck_ms":920},"status":"discard","description":"Parallelize 3 scrypt verifications, retry: 980-1139ms (within noise)","timestamp":1776553029840,"segment":5,"confidence":3.0707070707070705,"iterationTokens":1886,"asi":{"hypothesis":"Re-attempt parallelization of 3 scrypt verifyRecoveryCode calls within recovery test","rollback_reason":"Within-noise across 5 trials (980-1139ms), prior best was 963ms. Test is pretty insensitive to this micro-optimization — the verify-roundtrip test still has the initial hashRecoveryCode serial step.","trials":[1139,1042,980,982,987]}}
{"run":25,"commit":"a4c8c63","metric":900,"metrics":{"lint_ms":600,"test_ms":900,"typecheck_ms":920},"status":"keep","description":"Parallel scrypt verifies in recovery roundtrip: 963→900ms (-6.5%, cooled trials)","timestamp":1776556158037,"segment":5,"confidence":4.448484848484848,"iterationTokens":11052,"asi":{"approach":"Parallelize 3 verifyRecoveryCode scrypt calls in the recovery roundtrip test","files_changed":["src/__tests__/totp-module.test.ts"],"hypothesis":"Across 10 cooled trials, parallelizing the 3 scrypt verify calls in the recovery roundtrip test gives a small but real win","trial_metrics":[952,950,941,928,900,906,922,931,949]}}
{"run":26,"commit":"a4c8c63","metric":956,"metrics":{"lint_ms":600,"test_ms":956,"typecheck_ms":920},"status":"discard","description":"Verification rerun: 956ms best, prior best 900ms (within cooldown noise)","timestamp":1776556371771,"segment":5,"confidence":5.169014084507042,"iterationTokens":3293,"asi":{"hypothesis":"Cooled verification — confirm 900ms holds. Steady state ~950-980ms when system is busy with autoresearch loop.","rollback_reason":"Verification only — no code change. Best 956 vs prior 900 within typical cooldown variance."}}
{"run":27,"commit":"a4c8c63","metric":945,"metrics":{"lint_ms":600,"test_ms":945,"typecheck_ms":920},"status":"discard","description":"Final cooled verification: stable 945-976ms (best 945)","timestamp":1776556559176,"segment":5,"confidence":5.437037037037037,"iterationTokens":4761,"asi":{"hypothesis":"Re-baseline / final check after all optimizations","next_action_hint":"Real-world warm pre-commit (with lint-staged, no work) is ~1.06s wall — well under 1.5s and competitive. test_ms is the fundamental bottleneck (scrypt-bound TOTP tests + bun test startup).","rollback_reason":"Verification only — no code change. 945ms vs 900ms outlier is within typical ~50ms variance.","stable_range":"945-976ms across 8 cooled trials"}}
{"run":28,"commit":"a4c8c63","metric":970,"metrics":{"lint_ms":600,"test_ms":970,"typecheck_ms":920},"status":"discard","description":"Inline coverage gate (skip check-coverage.ts wrapper): 970ms (within noise)","timestamp":1776557087592,"segment":5,"confidence":7.0576923076923075,"iterationTokens":413,"asi":{"approach":"Inline `bun test --coverage` + coverage parsing in pre-commit.ts. Bench script also updated to match.","files_changed":["scripts/pre-commit.ts","scripts/bench-hooks.ts"],"hypothesis":"Skip the scripts/check-coverage.ts wrapper subprocess in pre-commit — inline the coverage parse into pre-commit.ts directly. Saves ~50ms wrapper-bun startup.","rollback_reason":"970ms vs prior best 900 within 50ms noise band; the inlined gate is functionally equivalent and slightly cleaner but does not show measurable hook-level win"}}
{"run":29,"commit":"a4c8c63","metric":951,"metrics":{"lint_ms":600,"test_ms":951,"typecheck_ms":920},"status":"discard","description":"Final stability check: 950ms steady state (was 6087ms baseline)","timestamp":1776557321177,"segment":5,"confidence":8.340909090909092,"iterationTokens":3842,"asi":{"final_state":"Pre-commit wall consistently 950-1100ms (best 900-950ms cooled). Original baseline 6087ms.","hypothesis":"Final stability check after all optimizations","rollback_reason":"Verification only — no code change. Confirms steady state. Total session improvement: 6087ms → ~950ms (-84%)","session_summary":"9 atomic commits: parallel hook scripts, eslint --cache, describe.concurrent for TOTP scrypt-bound tests, parallel subprocess guards, parallel scrypt verifies"}}
{"run":30,"commit":"a4c8c63","metric":944,"metrics":{"lint_ms":600,"test_ms":944,"typecheck_ms":920},"status":"discard","description":"Inline coverage gate in pre-commit.ts (skip wrapper subprocess): 944ms best","timestamp":1776557611735,"segment":5,"confidence":8.738095238095237,"iterationTokens":6910,"asi":{"approach":"Inline `bun test --coverage` in pre-commit.ts and parse coverage from text reporter directly. Bench script also inlined to match.","files_changed":["scripts/pre-commit.ts","scripts/bench-hooks.ts","autoresearch.ideas.md"],"hypothesis":"Skip the scripts/check-coverage.ts wrapper subprocess by inlining coverage parsing into pre-commit.ts. Cleaner architecture; saves ~50ms wrapper-bun startup. Also commits the accumulated session summary in autoresearch.ideas.md.","trial_metrics":[945,966,961,952,944,992,971,975,1011]}}
{"run":31,"commit":"a4c8c63","metric":975,"metrics":{"lint_ms":600,"test_ms":975,"typecheck_ms":920},"status":"discard","description":"Resume verification after timeout: 975ms best (within steady-state band)","timestamp":1776559752441,"segment":5,"confidence":9.291139240506329,"iterationTokens":1145,"asi":{"hypothesis":"After resume from interrupt: verify steady state. System has many concurrent vitest runs from other repos creating noise.","rollback_reason":"975 best vs 900 prior best (likely outlier from earlier cooled run); no code changes made","stable_range":"975-1174ms"}}
{"type":"config","name":"UT 优化：覆盖率与运行时间","metricName":"total_ms","metricUnit":"ms","bestDirection":"lower"}
{"run":32,"commit":"a4c8c63","metric":98,"metrics":{"web_lines":100,"web_funcs":100,"worker_lines":98.89,"worker_funcs":95.83,"cli_lines":98.14,"cli_funcs":96.88},"status":"keep","description":"Baseline: full UT coverage gate runs in ~100ms (parallel: web/worker/cli @ ~70ms each)","timestamp":1776896935135,"segment":6,"confidence":null,"iterationTokens":220,"asi":{"hypothesis":"Establish baseline for monorepo UT runtime + coverage","baseline":true,"uncovered":"worker/api-key-auth.ts 75% funcs, worker/routes/me.ts L15, cli/lib/json-input.ts 25-26,49-53","note":"Bun is extremely fast — runtime is already near-optimal at ~100ms wall. Main optimization angle is COVERAGE."}}
{"run":33,"commit":"f2ddfc2","metric":93,"metrics":{"cli_funcs":96.88,"cli_lines":98.14,"web_funcs":100,"web_lines":100,"worker_funcs":100,"worker_lines":99.44},"status":"keep","description":"Cover api-key-auth .catch + me.ts JSON.parse catch: worker_funcs 95.83→100, lines 98.89→99.44","timestamp":1776897042090,"segment":6,"confidence":null,"iterationTokens":1457,"asi":{"approach":"decodeJwtPayload non-JSON middle-segment test (covers L15) + apiKeyAuth updateLastUsed-rejection test (covers .catch arrow)","files_changed":["apps/worker/__tests__/me.test.ts","apps/worker/__tests__/middleware.test.ts"],"hypothesis":"Cover worker uncovered branches: api-key-auth.ts .catch arrow + me.ts JSON.parse catch","trick":"Used `for(i<3) await Promise.resolve()` instead of setTimeout(10ms) to flush microtask queue cheaply"}}
{"run":34,"commit":"89c4d38","metric":77,"metrics":{"cli_funcs":96.88,"cli_lines":98.14,"web_funcs":100,"web_lines":100,"worker_funcs":100,"worker_lines":99.44},"status":"keep","description":"Skip bash -c wrapper in check-coverage.ts: 93→77ms (-17%)","timestamp":1776897094331,"segment":6,"confidence":4.2,"iterationTokens":5215,"asi":{"approach":"Bun.spawn([\"bun\",\"test\",...]) directly instead of [\"bash\",\"-c\",cd ... && bun test ...]","files_changed":["scripts/check-coverage.ts"],"hypothesis":"Drop bash -c wrapper in check-coverage.ts — spawn bun directly with cwd"}}
