{"run":35,"commit":"89c4d38","metric":86,"metrics":{"cli_funcs":96.88,"cli_lines":98.14,"web_funcs":100,"web_lines":100,"worker_funcs":100,"worker_lines":99.44},"status":"discard","description":"setTimeout→microtask in apiKeyAuth test: not measurable at hook level (cli is long pole)","timestamp":1776897144320,"segment":6,"confidence":3.5,"iterationTokens":970,"asi":{"hypothesis":"Replace setTimeout(10) with microtask flush in apiKeyAuth happy-path test","lesson":"Wall is bottlenecked by cli group (~78ms), not worker. Worker test optimizations don't help wall time.","next_action_hint":"Target cli group: json-input.ts uncovered 25-26,49-53 (stdin paths)","rollback_reason":"Worker test isolation drops 10→56ms but wall=max(web,worker,cli) where cli=78ms is the long pole — within-noise at hook level"}}
{"run":36,"commit":"0381323","metric":62,"metrics":{"cli_funcs":100,"cli_lines":100,"web_funcs":100,"web_lines":100,"worker_funcs":100,"worker_lines":99.44},"status":"keep","description":"Cover json-input.ts stdin paths via fs.readFileSync spy: cli 96.88/98.14 → 100/100, total wall 77→62ms (best-of-7 with warmup)","timestamp":1776897623676,"segment":6,"confidence":4,"iterationTokens":4959,"asi":{"hypothesis":"Cover json-input.ts uncovered lines (stdin via fd 0) by spying on node:fs.readFileSync","approach":"spyOn(fs, 'readFileSync').mockImplementation for fd 0 — covers --data-file -, piped stdin, and readStdin error swallow paths","files_changed":["apps/cli/__tests__/json-input.test.ts"],"bench_method":"best-of-7 with 2 warmup runs to reduce macOS noise","next_action_hint":"CLI is now 100/100. Worker still 99.44 lines (me.ts L? unchanged). Wall pole is now ~52ms cli vs ~46ms worker — to drop wall, need to shrink cli or worker test execution time."}}
{"run":37,"commit":"e18dc60","metric":64,"metrics":{"cli_funcs":100,"cli_lines":100,"web_funcs":100,"web_lines":100,"worker_funcs":100,"worker_lines":100},"status":"keep","description":"Cover me.ts L37 (invalid JWT payload returns 401-shape body): worker 100/99.44 → 100/100; total within-noise 62→64ms (kept for coverage win)","timestamp":1776897673387,"segment":6,"confidence":2.5714285714285716,"iterationTokens":9169,"asi":{"approach":"request /api/me with 3-part JWT whose middle segment is non-JSON base64 (“aaa.aGVsbG8gd29ybGQ.ccc”)","files_changed":["apps/worker/__tests__/me.test.ts"],"hypothesis":"Cover me.ts L37 (return authenticated:false when decodeJwtPayload returns null) by sending header with malformed payload","next_action_hint":"All 3 groups now 100/100. To drop wall further, must shrink CLI execution (~52ms long pole). Bun startup is the floor."}}
{"run":38,"commit":"e18dc60","metric":63,"metrics":{"cli_funcs":100,"cli_lines":100,"web_funcs":100,"web_lines":100,"worker_funcs":100,"worker_lines":100},"status":"discard","description":"Steady-state verification: 63ms best across 10 trials, no code change","timestamp":1776897763376,"segment":6,"confidence":2.5714285714285716,"iterationTokens":7113,"asi":{"hypothesis":"Verify steady state after coverage wins","rollback_reason":"No code change — verification only. Best 63ms is consistent with prior 62-64ms.","stable_range":"63-78ms across 10 trials","trials":[66,120,64,64,63,64,78,67,65,66]}}
{"run":39,"commit":"71f57b3","metric":62,"metrics":{"cli_funcs":100,"cli_lines":100,"web_funcs":100,"web_lines":100,"worker_funcs":100,"worker_lines":100},"status":"discard","description":"Bun.readableStreamToText + parallel stdout drain in check-coverage.ts: tied at 62ms (within-noise)","timestamp":1776897935531,"segment":6,"confidence":4.235294117647059,"iterationTokens":2037,"asi":{"approach":"Bun.readableStreamToText + Promise.all instead of await ... new Response(...).text() x2; drop redundant cwd: repoRoot since process.cwd() already === repoRoot","files_changed":["scripts/check-coverage.ts"],"hypothesis":"Use Bun.readableStreamToText + parallel stdout/stderr drain to potentially reduce IPC drain latency","rollback_reason":"62ms ties prior best — no measurable speedup, within noise band. Code is cleaner but speedup is sub-noise."}}
{"run":40,"commit":"71f57b3","metric":64,"metrics":{"cli_funcs":100,"cli_lines":100,"web_funcs":100,"web_lines":100,"worker_funcs":100,"worker_lines":100},"status":"discard","description":"describe.concurrent on middleware.test.ts: 64ms (within-noise)","timestamp":1776897994556,"segment":6,"confidence":18,"iterationTokens":5794,"asi":{"hypothesis":"Mark middleware.test.ts describe blocks as concurrent (no shared state, all tests independent)","next_action_hint":"describe.concurrent only helps for slow async-bound tests; pure unit tests — even if I/O-shaped — are below the concurrent setup overhead","rollback_reason":"64ms vs 62ms best, within-noise; tests are too fast for concurrency overhead to pay off"}}
{"run":41,"commit":"71f57b3","metric":66,"metrics":{"cli_funcs":100,"cli_lines":100,"web_funcs":100,"web_lines":100,"worker_funcs":100,"worker_lines":100},"status":"discard","description":"Merge policies.test.ts into policies-coverage.test.ts: 8 cli files instead of 9 — within-noise (66 vs 62)","timestamp":1776898062672,"segment":6,"confidence":12,"iterationTokens":12688,"asi":{"approach":"Append 5 misc tests + new describe block to policies-coverage.test.ts; delete policies.test.ts","files_changed":["apps/cli/__tests__/policies-coverage.test.ts","apps/cli/__tests__/policies.test.ts (deleted)"],"hypothesis":"Merge policies.test.ts (5 tests, 259 lines) into policies-coverage.test.ts (15 tests, 465 lines) to save one test file load + duplicated helpers","lesson":"Bun test files are loaded efficiently — reducing file count rarely yields measurable wall-time wins. The bottleneck is per-test execution overhead inside one bun process.","rollback_reason":"66 vs 62 best, within-noise. Merging didn't measurably help. Keeping the original split for cleaner organization (policies.test.ts vs coverage-only tests)."}}
{"run":42,"commit":"71f57b3","metric":63,"metrics":{"cli_funcs":100,"cli_lines":100,"web_funcs":100,"web_lines":100,"worker_funcs":100,"worker_lines":100},"status":"discard","description":"Final stability check (15 trials): 63ms best, 62ms session best — at hardware floor","timestamp":1776898092436,"segment":6,"confidence":18,"iterationTokens":2315,"asi":{"final_state":"Coverage gate at hardware floor: ~62-66ms steady. All 3 groups 100/100 (web, worker, cli). Bun startup (~12ms) + parallel pole (cli ~50ms) = ~62ms wall.","hypothesis":"Final stability check after consolidation experiments","rollback_reason":"Verification only — no code change. 63 vs 62 best within typical ±3ms noise. Reverts of described, concurrent, file merge, and stream changes all landed back at this floor.","session_summary":"Segment 6: 98ms baseline → 62ms steady (-37%). Coverage 92.66→99.81 weighted → 100/100 across all groups. 2 keep commits: json-input.ts stdin paths via fs spy, me.ts L37 invalid-JWT branch."}}
{"run":43,"commit":"71f57b3","metric":62,"metrics":{"cli_funcs":100,"cli_lines":100,"web_funcs":100,"web_lines":100,"worker_funcs":100,"worker_lines":100},"status":"discard","description":"Final floor confirmation: 62ms tied (best of 15 trials, 2 warmups). Hardware floor reached.","timestamp":1776898181435,"segment":6,"confidence":18,"iterationTokens":7112,"asi":{"floor_analysis":"Bun startup ~12ms + parallel max(web 16ms, worker 46ms, cli 50ms) = ~62ms wall. CLI pole is dominated by policies-coverage.test.ts (36ms) module load + per-test JIT. Sub-ms test execution means describe.concurrent doesn't pay back its setup cost.","hypothesis":"Confirm steady state matches prior best (62ms)","ideas_dead":["bun build --compile (no PATH for spawn)","shell wrapper (same as bun script)","describe.concurrent (overhead > gain)","merge cli files (no measurable win)","lcov reporter (slower)","--only-failures (no diff)"],"rollback_reason":"Verification only; tied at session best 62ms"}}
{"run":44,"commit":"4456473","metric":63,"metrics":{"cli_funcs":100,"cli_lines":100,"web_funcs":100,"web_lines":100,"worker_funcs":100,"worker_lines":100},"status":"discard","description":"Use process.execPath for spawn (skip PATH lookup): 63ms within-noise","timestamp":1776898297012,"segment":6,"confidence":18,"iterationTokens":12883,"asi":{"approach":"process.execPath as bun binary path in Bun.spawn (skip $PATH lookup)","files_changed":["scripts/check-coverage.ts"],"hypothesis":"Pass absolute path to bun binary in Bun.spawn to skip PATH resolution overhead","rollback_reason":"63 vs 62 best, within ±3ms noise. PATH lookup is cached / not measurable on macOS."}}
{"run":45,"commit":"4456473","metric":64,"metrics":{"cli_funcs":100,"cli_lines":100,"web_funcs":100,"web_lines":100,"worker_funcs":100,"worker_lines":100},"status":"discard","description":"Bun.spawn stdout=Bun.file: 64ms within-noise","timestamp":1776898351756,"segment":6,"confidence":18,"iterationTokens":3634,"asi":{"approach":"Bun.spawn with stdout/stderr=Bun.file(tmpPath), then read file after exit","files_changed":["scripts/check-coverage.ts"],"hypothesis":"Direct file IO for stdout avoids stream-drain Promise overhead","rollback_reason":"64 vs 62 best, within noise. File IO has its own syscall cost — no measurable win."}}
{"run":46,"commit":"7f8bbef","metric":60,"metrics":{"web_lines":100,"web_funcs":100,"worker_lines":100,"worker_funcs":100,"cli_lines":100,"cli_funcs":100},"status":"discard","description":"Merge web+worker into single bun test shard: tied at 60ms best of 20","timestamp":1776898659388,"segment":6,"confidence":18,"iterationTokens":638,"asi":{"approach":"Group web+worker into single bun test invocation; cli stays own shard. Updated bench-ut.ts regex to handle combined group label.","comparison":"20-trial best: 60ms (merged) vs 60ms (original 3-shard). Tied.","files_changed":["scripts/check-coverage.ts","scripts/bench-ut.ts"],"hypothesis":"Reduce process count from 3 to 2 by combining web+worker (web=16ms+worker=46ms in one proc ≈ 46ms anyway, since web tests are fast)","rollback_reason":"Same 60ms best across 20 trials — process startup parallelization isn't the bottleneck. cli pole at ~50ms is unchanged."}}
{"run":47,"commit":"7f8bbef","metric":60,"metrics":{"web_lines":100,"web_funcs":100,"worker_lines":100,"worker_funcs":100,"cli_lines":100,"cli_funcs":100},"status":"discard","description":"Skip `bun run` wrapper in test:coverage script: 60ms tied (within-noise)","timestamp":1776898850521,"segment":6,"confidence":24,"iterationTokens":11238,"asi":{"approach":"package.json: \"test:coverage\": \"bun scripts/check-coverage.ts\" (skip \"bun run\" wrapper). bench-ut.ts also updated to skip \"run\".","files_changed":["package.json","scripts/bench-ut.ts"],"hypothesis":"Skip `bun run` script-resolution overhead (~2ms) on test:coverage invocations","isolated_savings":"bun run vs bun direct: 63ms vs 61ms isolated; lost in 60ms wall noise band","rollback_reason":"60ms tied with prior best across 20 trials; the 1-2ms saving is below the 3-5ms noise floor for the gate. Real-world cleanup but unmeasurable here."}}
{"run":48,"commit":"fd7a294","metric":57,"metrics":{"cli_funcs":100,"cli_lines":100,"web_funcs":100,"web_lines":100,"worker_funcs":100,"worker_lines":100},"status":"keep","description":"Hoist Bun.spawn to top-level in check-coverage.ts: 60ms→57ms (-5%)","timestamp":1776898991852,"segment":6,"confidence":41,"iterationTokens":268,"asi":{"approach":"Move Bun.spawn calls to top-level (above type/helper declarations) so the 3 child bun procs start immediately when the script begins, in parallel with the rest of the script's parse/eval","comparison":"Same-session 30-trial best: 57ms (hoisted) vs 61ms (original) — 4ms above noise floor","files_changed":["scripts/check-coverage.ts"],"hypothesis":"Hoist child-proc Bun.spawn calls to top-level so they start before the parser reaches the rest of the script. Saves ~3-5ms by overlapping spawn syscall with script JIT.","next_action_hint":"Floor is now 57-60ms. cli pole is still ~50ms. Further wins would need to attack cli pole or eliminate parent bun startup."}}
{"run":49,"commit":"fd7a294","metric":59,"metrics":{"cli_funcs":100,"cli_lines":100,"web_funcs":100,"web_lines":100,"worker_funcs":100,"worker_lines":100},"status":"discard","description":"Drop cwd from Bun.spawn (use process.cwd default): tied (59-63 best vs 57 prior)","timestamp":1776899034713,"segment":6,"confidence":20.5,"iterationTokens":3233,"asi":{"approach":"Drop `cwd: repoRoot` from Bun.spawn since process.cwd() == repo root already","files_changed":["scripts/check-coverage.ts"],"hypothesis":"Skip import.meta.dir computation + cwd config","rollback_reason":"59-63ms across 90 trials (3x30); tied with prior 57ms best within noise. Removing cwd has no measurable effect."}}
{"run":50,"commit":"fd7a294","metric":61,"metrics":{"cli_funcs":100,"cli_lines":100,"web_funcs":100,"web_lines":100,"worker_funcs":100,"worker_lines":100},"status":"discard","description":"3 explicit Bun.spawn statements (cli first): 61-62ms tied (within noise)","timestamp":1776899091439,"segment":6,"confidence":20.5,"iterationTokens":3995,"asi":{"approach":"Replace .map() with 3 explicit Bun.spawn statements; spawn cli first since it's the long pole","files_changed":["scripts/check-coverage.ts"],"hypothesis":"Eliminate .map array allocation + spawn cli (long pole) first so it gets earliest start","rollback_reason":"61-62ms across 90 trials vs prior best 57ms (likely lucky outlier). Within current noise band; no measurable improvement from spawn ordering."}}
{"run":51,"commit":"fd7a294","metric":62,"metrics":{"web_lines":100,"web_funcs":100,"worker_lines":100,"worker_funcs":100,"cli_lines":100,"cli_funcs":100},"status":"discard","description":"FORCE_COLOR=0/NO_COLOR=1 env to skip ANSI rendering: 62ms (within-noise vs 57 prior best)","timestamp":1776900654787,"segment":6,"confidence":27.333333333333332,"iterationTokens":913,"asi":{"hypothesis":"Skip ANSI color generation in bun test output to reduce stdout work","approach":"Pass FORCE_COLOR=0 and NO_COLOR=1 in spawn env","rollback_reason":"62ms vs 57ms prior best, within ±5ms noise band. Either ANSI rendering is not measurable, or bun test already detects non-TTY and skips it.","next_action_hint":"Try removing stderr pipe entirely (use 'ignore') to drop one Response().text() drain"}}
{"run":52,"commit":"fd7a294","metric":61,"metrics":{"cli_funcs":100,"cli_lines":100,"web_funcs":100,"web_lines":100,"worker_funcs":100,"worker_lines":100},"status":"discard","description":"stdout=ignore + single stderr drain (coverage table is on stderr): 61ms (within-noise vs 57)","timestamp":1776900681152,"segment":6,"confidence":20.5,"iterationTokens":2649,"asi":{"approach":"stdout: ignore + drop Promise.all stderr drain (only need stderr where 'All files' appears)","files_changed":["scripts/check-coverage.ts"],"hypothesis":"Save one Response().text() drain by ignoring stdout (bun test writes coverage table to stderr) and reading only stderr","rollback_reason":"61ms vs 57ms prior best, within ±5ms noise band. The single-stream drain doesn't show measurable improvement at the gate level."}}
{"run":53,"commit":"fd7a294","metric":62,"metrics":{"cli_funcs":100,"cli_lines":100,"web_funcs":100,"web_lines":100,"worker_funcs":100,"worker_lines":100},"status":"discard","description":"30-trial verification: 62ms best, steady at hardware floor","timestamp":1776900700899,"segment":6,"confidence":27.333333333333332,"iterationTokens":1750,"asi":{"hypothesis":"30-trial confirmation of steady state at hardware floor","stable_range":"62-90ms across 30 trials, best 62ms","rollback_reason":"Verification only — no code change. 62 vs 57 prior best within typical ±5ms noise across many sessions. Hardware floor confirmed.","session_total":"98ms baseline → 57-62ms steady (-37 to -42%)"}}
{"run":54,"commit":"fd7a294","metric":61,"metrics":{"cli_funcs":100,"cli_lines":100,"web_funcs":100,"web_lines":100,"worker_funcs":100,"worker_lines":100},"status":"discard","description":"Skip 'bun run' wrapper in bench-ut.ts: 61ms (within-noise vs 57)","timestamp":1776900741042,"segment":6,"confidence":20.5,"iterationTokens":3488,"asi":{"approach":"spawn 'bun scripts/check-coverage.ts' instead of 'bun run scripts/check-coverage.ts' in bench-ut.ts","files_changed":["scripts/bench-ut.ts"],"hypothesis":"Skip 'bun run' script-resolution overhead in the bench harness so the measurement reflects the true gate cost","rollback_reason":"61ms vs 57ms prior best, within ±5ms noise floor. The 1-2ms 'bun run' resolution saving is below noise."}}
{"run":55,"commit":"2841fdd","metric":61,"metrics":{"cli_funcs":100,"cli_lines":100,"web_funcs":100,"web_lines":100,"worker_funcs":100,"worker_lines":100},"status":"keep","description":"Final stop: 61ms steady, ideas.md updated with dead ends. Session: 98→61ms (-38%), 100/100 cov.","timestamp":1776900779911,"segment":6,"confidence":27.333333333333332,"iterationTokens":2729,"asi":{"hypothesis":"Steady state floor confirmation post-session, with updated ideas.md capturing dead ends from this segment","files_changed":["autoresearch.ideas.md"],"next_action_hint":"Hardware floor reached. Future sessions: try incremental gate (per-group hash cache) IF the 'no skipping tests' rule allows it.","session_keeps":["json-input.ts stdin spy (cli 100/100)","me.ts L37 invalid-JWT (worker 100/100)","skip bash -c wrapper (-17%)","hoist Bun.spawn to top-level (-5%)"],"session_summary":"98ms baseline → 61ms steady (-38%); coverage 92.66 weighted → 100/100 across all 3 groups","stable_floor":"57-62ms across many sessions"}}
{"run":56,"commit":"2841fdd","metric":61,"metrics":{"cli_funcs":100,"cli_lines":100,"web_funcs":100,"web_lines":100,"worker_funcs":100,"worker_lines":100},"status":"discard","description":"BUN_RUNTIME_TRANSPILER_CACHE_PATH on child procs: cache stays empty, no effect (61ms within-noise)","timestamp":1776900813671,"segment":6,"confidence":41,"iterationTokens":3043,"asi":{"approach":"Set BUN_RUNTIME_TRANSPILER_CACHE_PATH on the spawned bun test procs (not parent) and pre-create cache dir","files_changed":["scripts/check-coverage.ts"],"hypothesis":"Persistent transpile cache for bun test procs would skip re-parsing of source modules across runs","next_action_hint":"BUN_RUNTIME_TRANSPILER_CACHE_PATH appears to be no-op for bun test in 1.3.11","rollback_reason":"61ms vs 57 prior best, within noise. Confirmed cache dir stays empty after 20 runs — the env var isn't honored for `bun test`."}}
{"run":57,"commit":"2841fdd","metric":61,"metrics":{"cli_funcs":100,"cli_lines":100,"web_funcs":100,"web_lines":100,"worker_funcs":100,"worker_lines":100},"status":"discard","description":"Reorder spawn (cli first): 60-61ms (within-noise vs 57)","timestamp":1776900846598,"segment":6,"confidence":41,"iterationTokens":514,"asi":{"approach":"Reorder spawn array to [cli, worker, web] so the long-pole cli proc forks first","files_changed":["scripts/check-coverage.ts"],"hypothesis":"Spawn the long-pole cli proc first so it gets ~50μs head start over web/worker","rollback_reason":"60-61ms vs 57 prior best, within ±5ms noise. .map iteration order saves <1ms; sub-noise.","trials":[60,61]}}
{"run":58,"commit":"2841fdd","metric":60,"metrics":{"cli_funcs":100,"cli_lines":100,"web_funcs":100,"web_lines":100,"worker_funcs":100,"worker_lines":100},"status":"discard","description":"--reporter=dots: 60ms (within-noise vs 57)","timestamp":1776900875362,"segment":6,"confidence":41,"iterationTokens":2440,"asi":{"approach":"Add --reporter=dots to bun test invocations to reduce per-test console rendering","files_changed":["scripts/check-coverage.ts"],"hypothesis":"dots reporter writes one char per test instead of full PASS line, so less stdout/stderr","rollback_reason":"60ms vs 57 prior best, within noise. Bun's default reporter buffers output already."}}
{"run":59,"commit":"2841fdd","metric":59,"metrics":{"cli_funcs":100,"cli_lines":100,"web_funcs":100,"web_lines":100,"worker_funcs":100,"worker_lines":100},"status":"discard","description":"Floor confirmation: 59ms best of 30 trials","timestamp":1776900905920,"segment":6,"confidence":27.333333333333332,"iterationTokens":2301,"asi":{"hypothesis":"Final baseline run confirming hardware floor","rollback_reason":"Verification only — no code change. 59ms best across 30 trials confirms steady state ~57-62ms.","session_total_experiments":27,"stable_floor":"57-62ms"}}
{"run":60,"commit":"2df1b81","metric":58,"metrics":{"cli_funcs":100,"cli_lines":100,"web_funcs":100,"web_lines":100,"worker_funcs":100,"worker_lines":100},"status":"keep","description":"bun --bun test in spawned procs: 58ms steady (was 59-60), isolated cli proc 71→51ms (-28%)","timestamp":1776900943923,"segment":6,"confidence":20.5,"iterationTokens":588,"asi":{"approach":"Add --bun flag to spawned bun test invocations (forces bun runtime, avoids node-compat overhead in some paths)","files_changed":["scripts/check-coverage.ts"],"hypothesis":"bun --bun test is faster in isolation (44ms vs 59ms for cli) so flag may shave a few ms at gate level too","isolated_savings":"cli proc: 71→51ms wall (-28%)","next_action_hint":"Coverage parsing still works correctly. Re-run multiple times to confirm 1-2ms improvement is real or noise.","trials":[58,58]}}
{"run":61,"commit":"2df1b81","metric":61,"metrics":{"cli_funcs":100,"cli_lines":100,"web_funcs":100,"web_lines":100,"worker_funcs":100,"worker_lines":100},"status":"discard","description":"Re-verify --bun: 61ms (within noise vs 58 best), update ideas.md with --bun win","timestamp":1776900995244,"segment":6,"confidence":27.333333333333332,"iterationTokens":5059,"asi":{"files_changed":["autoresearch.ideas.md"],"hypothesis":"Confirmation re-bench post --bun flag commit; 30 trials","rollback_reason":"Verification only. 61ms vs 58 prior best within noise; --bun win still holds across many trials. autoresearch.ideas.md now lists --bun finding for future sessions.","stable_floor":"58-62ms"}}
